{"expected_analysis_record_count":38740,"expected_m4_requirement_set_digest":"04b2d279cec33b44ecbaa5b4531142a8c25d879b36079f87349e3314528a10dc","expected_no_requirements_applicable_count":0,"expected_oracle_identity_count":38740,"expected_requirement_count":5,"expected_requirements_produced_card_count":5,"expected_structural_record_count":38740,"expected_unresolved_analysis_count":38735,"lock_version":1,"m1_structural_aggregate_digest":"eb215ca6c904c26baa2d8f0a63928e8c9acab5bb9ea9493eacebcdab2fbb86bb","m1_structural_manifest_sha256":"bdc74ec944798a8c1dd7627dae55a795c6fb72d3bbe067d2f2e50412c7155f2b","m1_structural_schema":"census.structural-card.v1","m2_bundle_schema":"census.semantic-requirement-bundle.v1","m2_requirement_schema":"census.semantic-requirement.v1","m3_analysis_manifest_sha256":"f69cd3890de54278c231bb6bd8fb0125a31903c2b01d85c81ad1e5d732f9276f","m3_analysis_schema":"census.card-analysis.v1","m3_record_identity_set_digest":"acf03f0d67c8d8cbb3067ed5ffb12b33f3f27a7329c327435ef4445d74678ba9","m3_record_index_digest":"0c5522d64dc6cb50984ca535d8aa5a07d936b0fe6efc8f056d6061fc29af28a6","m3_trace_index_digest":"591d5157e1b1067fa9c6926907c2dda03b89716ce23b051eeb892b49138d5c89","m4_dimension_registry_version":"1","m4_ontology_schema":"census.capability-ontology.v1","schema":"census.census-input-lock.v1","source_lock_digest":"4767dccbb518b4009c235bb1ce531f509c0923ba0ebe190936c2dc2d14e2d4bd","source_lock_file_sha256":"4916fe8c9eba177642efcdfeaa542e6a5d88bc06836cd7d8cd4e274168eaf0e7"}